Language,original,english,czech,german,russian,polish,hungarian,italian,spanish,french,chinese,japanese,portuguese,chinesesimp
STR_Q102_Desc3,"Thank you for your adventurous visit. I see few humans here since the World went into a tailspin. To fight against boredom, could you bring me a book. The one I would like to read deals with a subject you are familiar with. It is a novel by a Norwegian author. However you will find the copy in English. This story is very familiar to you. It was probably holding you when you woke up on the beach.","Thank you for your adventurous visit. I see few humans here since the World went into a tailspin. To fight against boredom, could you bring me a book. The one I would like to read deals with a subject you are familiar with. It is a novel by a Norwegian author. However you will find the copy in English. This story is very familiar to you. It was probably holding you when you woke up on the beach.","Děkujeme za vaši dobrodružnou návštěvu. Od té doby, co se svět dostal do vývrtky, tu vidím jen málo lidí. V boji proti nudě, mohl bys mi přinést knihu. Ten, který bych si rád přečetl, se zabývá tématem, které znáte. Je to román norského autora. Kopii však najdete v angličtině. Tento příběh je vám velmi známý. Nejspíš tě to drželo, když jsi se probudil na pláži.","Vielen Dank für Ihren erlebnisreichen Besuch. Ich sehe hier nur wenige Menschen, seit die Welt ins Trudeln geraten ist. Um die Langeweile zu bekämpfen, könnten Sie mir bitte ein Buch mitbringen. Der Artikel, den ich gerne lesen würde, befasst sich mit einem Thema, mit dem Sie vertraut sind. Es ist ein Roman eines norwegischen Autors. Sie finden die Kopie jedoch auf Englisch. Diese Geschichte kommt Ihnen sehr bekannt vor. Es hat dich wahrscheinlich festgehalten, als du am Strand aufgewacht bist.","Спасибо за ваш приключенческий визит. Я вижу здесь мало людей с тех пор, как мир вошел в штопор. Чтобы бороться со скукой, не могли бы вы принести мне книгу. Тот, который я хотел бы прочитать, посвящен теме, с которой вы знакомы. Это роман норвежского автора. Однако вы найдете копию на английском языке. Эта история вам очень знакома. Вероятно, оно держало тебя, когда ты очнулся на пляже.","Dziękuję za wizytę pełną przygód. Widzę tu niewielu ludzi, odkąd Świat wpadł w szał. Aby pokonać nudę, czy mógłbyś przynieść mi książkę. Ta, którą chciałbym przeczytać, dotyczy tematu, który znasz. Jest to powieść norweskiego autora. Znajdziesz jednak kopię w języku angielskim. Ta historia jest Ci bardzo znana. Prawdopodobnie trzymał cię, kiedy obudziłeś się na plaży.","Köszönjük kalandos látogatását. Kevés embert látok itt, mióta a világ összeomlott. Az unalom elleni küzdelemhez hozhatna nekem egy könyvet. Az, amit el szeretnék olvasni, egy Ön által ismert témával foglalkozik. Ez egy norvég író regénye. A példányt azonban megtalálod angolul. Ez a történet nagyon ismerős számodra. Valószínűleg ez tartott, amikor felébredtél a tengerparton.","Grazie per la tua avventurosa visita. Vedo pochi umani qui da quando il mondo è andato in tilt. Per combattere la noia, potresti portarmi un libro. Quello che mi piacerebbe leggere tratta di un argomento che ti è familiare. È un romanzo di un autore norvegese. Troverai comunque la copia in inglese. Questa storia ti è molto familiare. Probabilmente ti stava trattenendo quando ti sei svegliato sulla spiaggia.","Gracias por tu visita aventurera. Veo pocos humanos aquí desde que el mundo cayó en picada. Para luchar contra el aburrimiento, ¿podrías traerme un libro? El que me gustaría leer trata sobre un tema que usted conoce. Es una novela de un autor noruego. Sin embargo encontrarás la copia en inglés. Esta historia te resulta muy familiar. Probablemente te estaba abrazando cuando te despertaste en la playa.","Merci pour votre visite aventurier. Je vois peu d'humains ici depuis que le Monde est parti en vrille. Pour lutter contre l'ennui, pourriez vous me rapporter un livre. Celui que j'aimerais lire traite d'un sujet que vous connaissez bien. C'est le roman d'un auteur norvégien. Pourtant vous trouverez l'exemplaire en Anglais. Cette histoire vous est bien familière. Elle vous tenaillait certainement lorsque vous vous êtes éveillé sur la plage.",感谢您的冒险访问。自从世界陷入混乱以来，我在这里很少见到人类。为了对抗无聊，你能给我带一本书吗？我想读的一本涉及您熟悉的主题。这是挪威作家的小说。不过，您会找到英文副本。这个故事你很熟悉。当你在海滩上醒来时，它可能正抱着你。,冒険的な訪問をしていただきありがとうございます。世界が大混乱に陥って以来、ここでは人間の姿をほとんど見かけません。退屈と戦うために、本を持ってきてくれませんか。私が読みたいのは、あなたがよく知っている主題を扱ったものです。ノルウェーの作家による小説です。ただし、コピーは英語で表示されます。この話はあなたにとってもよく知られた話です。あなたがビーチで目覚めたとき、それはおそらくあなたを抱きしめていたでしょう。,"Obrigado pela sua visita aventureira. Vejo poucos humanos aqui desde que o mundo entrou em parafuso. Para lutar contra o tédio, você poderia me trazer um livro. Aquele que eu gostaria de ler trata de um assunto com o qual você está familiarizado. É um romance de um autor norueguês. No entanto, você encontrará a cópia em inglês. Esta história é muito familiar para você. Provavelmente estava segurando você quando você acordou na praia.",感谢您的冒险访问。自从世界陷入混乱以来，我在这里很少见到人类。为了对抗无聊，你能给我带一本书吗？我想读的一本涉及您熟悉的主题。这是挪威作家的小说。不过，您会找到英文副本。这个故事你很熟悉。当你在海滩上醒来时，它可能正抱着你。
STR_Q102_Obj,Go visit Elias at the Proud Chernarus hunting camp.,Go visit Elias at the Proud Chernarus hunting camp.,Jděte navštívit Eliase do loveckého tábora Proud Chernarus.,Besuchen Sie Elias im Jagdlager Proud Chernarus.,Отправляйтесь к Элиасу в охотничий лагерь «Гордая Чернорусь».,Idź odwiedzić Eliasa w obozie myśliwskim Dumnej Czarnorusi.,Látogassa meg Eliast a Proud Chernarus vadásztáborban.,Vai a trovare Elias al campo di caccia del Proud Chernarus.,Ve a visitar a Elias en el campamento de caza de Proud Chernarus.,Va rendre visite à Elias au camp de chasse de Proud Chernarus.,前往 Proud Chernarus 狩猎营地拜访 Elias。,プラウド・チェルナルスの狩猟キャンプにいるエリアスに会いに行きましょう。,Vá visitar Elias no campo de caça Proud Chernarus.,前往 Proud Chernarus 狩猎营地拜访 Elias。
STR_O102_Obj,Look for Elias,Look for Elias,Hledej Eliase,Suchen Sie nach Elias,Ищите Элиаса,Poszukaj Eliasa,Keresd Eliast,Cerca Elias,busca a elias,Cherchez Elias,寻找埃利亚斯,エリアスを探せ,Procure Elias,寻找埃利亚斯

STR_Q400_Title,Elias,Elias,Eliáš,Elias,Элиас,Eliasz,Elias,Elia,Elías,Je n'ai pas de quêtes à te proposer pour le moment,埃利亚斯,エリアス,Elias,埃利亚斯
STR_Q400_Desc1,"Thank you for your adventurous visit. I see few humans here since the World went into a tailspin. To combat boredom, could you bring me a book. The one I would like to read deals with a subject you are familiar with. It is a novel by a Norwegian author. However you will find the copy in English. This story is very familiar to you. It was probably holding you when you woke up on the beach.","Thank you for your adventurous visit. I see few humans here since the World went into a tailspin. To combat boredom, could you bring me a book. The one I would like to read deals with a subject you are familiar with. It is a novel by a Norwegian author. However you will find the copy in English. This story is very familiar to you. It was probably holding you when you woke up on the beach.","Děkujeme za vaši dobrodružnou návštěvu. Od té doby, co se svět dostal do vývrtky, tu vidím jen málo lidí. Pro boj s nudou, mohl bys mi přinést knihu. Ten, který bych si rád přečetl, se zabývá tématem, které znáte. Je to román norského autora. Kopii však najdete v angličtině. Tento příběh je vám velmi známý. Nejspíš tě to drželo, když jsi se probudil na pláži.","Vielen Dank für Ihren erlebnisreichen Besuch. Ich sehe hier nur wenige Menschen, seit die Welt ins Trudeln geraten ist. Um der Langeweile entgegenzuwirken, könnten Sie mir bitte ein Buch mitbringen. Der Artikel, den ich gerne lesen würde, befasst sich mit einem Thema, mit dem Sie vertraut sind. Es ist ein Roman eines norwegischen Autors. Sie finden die Kopie jedoch auf Englisch. Diese Geschichte kommt Ihnen sehr bekannt vor. Es hat dich wahrscheinlich festgehalten, als du am Strand aufgewacht bist.","Спасибо за ваш приключенческий визит. Я вижу здесь мало людей с тех пор, как мир вошел в штопор. Чтобы побороть скуку, не могли бы вы принести мне книгу. Тот, который я хотел бы прочитать, посвящен теме, с которой вы знакомы. Это роман норвежского автора. Однако вы найдете копию на английском языке. Эта история вам очень знакома. Вероятно, оно держало тебя, когда ты очнулся на пляже.","Dziękuję za wizytę pełną przygód. Widzę tu niewielu ludzi, odkąd Świat wpadł w szał. Aby pokonać nudę, mógłbyś przynieść mi książkę. Ta, którą chciałbym przeczytać, dotyczy tematu, który znasz. Jest to powieść norweskiego autora. Znajdziesz jednak kopię w języku angielskim. Ta historia jest Ci bardzo znana. Prawdopodobnie trzymał cię, kiedy obudziłeś się na plaży.","Köszönjük kalandos látogatását. Kevés embert látok itt, mióta a világ összeomlott. Az unalom leküzdésére hozhatna nekem egy könyvet. Az, amit el szeretnék olvasni, egy Ön által ismert témával foglalkozik. Ez egy norvég író regénye. A példányt azonban megtalálod angolul. Ez a történet nagyon ismerős számodra. Valószínűleg ez tartott, amikor felébredtél a tengerparton.","Grazie per la tua avventurosa visita. Vedo pochi umani qui da quando il mondo è andato in tilt. Per combattere la noia, potresti portarmi un libro. Quello che mi piacerebbe leggere tratta di un argomento che ti è familiare. È un romanzo di un autore norvegese. Troverai comunque la copia in inglese. Questa storia ti è molto familiare. Probabilmente ti stava trattenendo quando ti sei svegliato sulla spiaggia.","Gracias por tu visita aventurera. Veo pocos humanos aquí desde que el mundo cayó en picada. Para combatir el aburrimiento, ¿podrías traerme un libro? El que me gustaría leer trata sobre un tema que usted conoce. Es una novela de un autor noruego. Sin embargo encontrarás la copia en inglés. Esta historia te resulta muy familiar. Probablemente te estaba abrazando cuando te despertaste en la playa.",Que veux-tu? Je suis occupé...,感谢您的冒险访问。自从世界陷入混乱以来，我在这里很少见到人类。为了打发无聊，你能给我带一本书吗？我想读的一本涉及您熟悉的主题。这是挪威作家的小说。不过，您会找到英文副本。这个故事你很熟悉。当你在海滩上醒来时，它可能正抱着你。,冒険的な訪問をしていただきありがとうございます。世界が大混乱に陥って以来、ここでは人間の姿をほとんど見かけません。退屈しのぎに、本を持ってきてくれませんか。私が読みたいのは、あなたがよく知っている主題を扱ったものです。ノルウェーの作家による小説です。ただし、コピーは英語で表示されます。この話はあなたにとってもよく知られた話です。あなたがビーチで目覚めたとき、それはおそらくあなたを抱きしめていたでしょう。,"Obrigado pela sua visita aventureira. Vejo poucos humanos aqui desde que o mundo entrou em parafuso. Para combater o tédio, você poderia me trazer um livro. Aquele que eu gostaria de ler trata de um assunto com o qual você está familiarizado. É um romance de um autor norueguês. No entanto, você encontrará a cópia em inglês. Esta história é muito familiar para você. Provavelmente estava segurando você quando você acordou na praia.",感谢您的冒险访问。自从世界陷入混乱以来，我在这里很少见到人类。为了打发无聊，你能给我带一本书吗？我想读的一本涉及您熟悉的主题。这是挪威作家的小说。不过，您会找到英文副本。这个故事你很熟悉。当你在海滩上醒来时，它可能正抱着你。
STR_Q400_Desc2,Elias seems eager to read. Find and bring him that book which is close to his heart,Elias seems eager to read. Find and bring him that book which is close to his heart,"Zdá se, že Eliáš má chuť číst. Najděte a přineste mu knihu, která je blízká jeho srdci","Elias scheint lesebegierig zu sein. Finden und bringen Sie ihm das Buch, das ihm am Herzen liegt","Элиасу, кажется, очень хочется читать. Найдите и принесите ему ту книгу, которая близка его сердцу.","Elias wydaje się chętny do czytania. Znajdź i przynieś mu książkę, która jest bliska jego sercu","Elias szívesen olvas. Keresse meg és vigye el neki azt a könyvet, amely közel áll a szívéhez",Elias sembra desideroso di leggere. Trova e portagli quel libro che gli sta a cuore,Elías parece ansioso por leer. Encuentra y llévale ese libro que está cerca de su corazón.,Il n'y a rien à faire ici pour vous... Revenez demain.,埃利亚斯似乎很想读书。找到并带给他那本他最喜欢的书,エリアスは本を読みたがっているようだ。彼の心にある本を見つけて持ってきてください,Elias parece ansioso para ler. Encontre e traga para ele aquele livro que está perto de seu coração,埃利亚斯似乎很想读书。找到并带给他那本他最喜欢的书
STR_Q400_Desc3,"Thank you for your adventurous visit. I see few humans here since the World went into a tailspin. To combat boredom, could you bring me a book. The one I would like to read deals with a subject you are familiar with. It is a novel by a Norwegian author. However you will find the copy in English. This story is very familiar to you. It was probably holding you when you woke up on the beach.","Thank you for your adventurous visit. I see few humans here since the World went into a tailspin. To combat boredom, could you bring me a book. The one I would like to read deals with a subject you are familiar with. It is a novel by a Norwegian author. However you will find the copy in English. This story is very familiar to you. It was probably holding you when you woke up on the beach.","Děkujeme za vaši dobrodružnou návštěvu. Od té doby, co se svět dostal do vývrtky, tu vidím jen málo lidí. Pro boj s nudou, mohl bys mi přinést knihu. Ten, který bych si rád přečetl, se zabývá tématem, které znáte. Je to román norského autora. Kopii však najdete v angličtině. Tento příběh je vám velmi známý. Nejspíš tě to drželo, když jsi se probudil na pláži.","Vielen Dank für Ihren erlebnisreichen Besuch. Ich sehe hier nur wenige Menschen, seit die Welt ins Trudeln geraten ist. Um der Langeweile entgegenzuwirken, könnten Sie mir bitte ein Buch mitbringen. Der Artikel, den ich gerne lesen würde, befasst sich mit einem Thema, mit dem Sie vertraut sind. Es ist ein Roman eines norwegischen Autors. Sie finden die Kopie jedoch auf Englisch. Diese Geschichte kommt Ihnen sehr bekannt vor. Es hat dich wahrscheinlich festgehalten, als du am Strand aufgewacht bist.","Спасибо за ваш приключенческий визит. Я вижу здесь мало людей с тех пор, как мир вошел в штопор. Чтобы побороть скуку, не могли бы вы принести мне книгу. Тот, который я хотел бы прочитать, посвящен теме, с которой вы знакомы. Это роман норвежского автора. Однако вы найдете копию на английском языке. Эта история вам очень знакома. Вероятно, оно держало тебя, когда ты очнулся на пляже.","Dziękuję za wizytę pełną przygód. Widzę tu niewielu ludzi, odkąd Świat wpadł w szał. Aby pokonać nudę, mógłbyś przynieść mi książkę. Ta, którą chciałbym przeczytać, dotyczy tematu, który znasz. Jest to powieść norweskiego autora. Znajdziesz jednak kopię w języku angielskim. Ta historia jest Ci bardzo znana. Prawdopodobnie trzymał cię, kiedy obudziłeś się na plaży.","Köszönjük kalandos látogatását. Kevés embert látok itt, mióta a világ összeomlott. Az unalom leküzdésére hozhatna nekem egy könyvet. Az, amit el szeretnék olvasni, egy Ön által ismert témával foglalkozik. Ez egy norvég író regénye. A példányt azonban megtalálod angolul. Ez a történet nagyon ismerős számodra. Valószínűleg ez tartott, amikor felébredtél a tengerparton.","Grazie per la tua avventurosa visita. Vedo pochi umani qui da quando il mondo è andato in tilt. Per combattere la noia, potresti portarmi un libro. Quello che mi piacerebbe leggere tratta di un argomento che ti è familiare. È un romanzo di un autore norvegese. Troverai comunque la copia in inglese. Questa storia ti è molto familiare. Probabilmente ti stava trattenendo quando ti sei svegliato sulla spiaggia.","Gracias por tu visita aventurera. Veo pocos humanos aquí desde que el mundo cayó en picada. Para combatir el aburrimiento, ¿podrías traerme un libro? El que me gustaría leer trata sobre un tema que usted conoce. Es una novela de un autor noruego. Sin embargo encontrarás la copia en inglés. Esta historia te resulta muy familiar. Probablemente te estaba abrazando cuando te despertaste en la playa.",Je n'ai pas de quêtes à te proposer pour le moment,感谢您的冒险访问。自从世界陷入混乱以来，我在这里很少见到人类。为了打发无聊，你能给我带一本书吗？我想读的一本涉及您熟悉的主题。这是挪威作家的小说。不过，您会找到英文副本。这个故事你很熟悉。当你在海滩上醒来时，它可能正抱着你。,冒険的な訪問をしていただきありがとうございます。世界が大混乱に陥って以来、ここでは人間の姿をほとんど見かけません。退屈しのぎに、本を持ってきてくれませんか。私が読みたいのは、あなたがよく知っている主題を扱ったものです。ノルウェーの作家による小説です。ただし、コピーは英語で表示されます。この話はあなたにとってもよく知られた話です。あなたがビーチで目覚めたとき、それはおそらくあなたを抱きしめていたでしょう。,"Obrigado pela sua visita aventureira. Vejo poucos humanos aqui desde que o mundo entrou em parafuso. Para combater o tédio, você poderia me trazer um livro. Aquele que eu gostaria de ler trata de um assunto com o qual você está familiarizado. É um romance de um autor norueguês. No entanto, você encontrará a cópia em inglês. Esta história é muito familiar para você. Provavelmente estava segurando você quando você acordou na praia.",感谢您的冒险访问。自从世界陷入混乱以来，我在这里很少见到人类。为了打发无聊，你能给我带一本书吗？我想读的一本涉及您熟悉的主题。这是挪威作家的小说。不过，您会找到英文副本。这个故事你很熟悉。当你在海滩上醒来时，它可能正抱着你。
STR_Q400_Obj,Find the book for Elias,Find the book for Elias,Najděte knihu pro Eliáše,Finde das Buch für Elias,Найдите книгу Элиаса.,Znajdź księgę dla Eliasa,Keresd meg Elias könyvét,Trova il libro per Elias,Encuentra el libro de Elías.,Que veux-tu? Je suis occupé...,找到埃利亚斯的书,エリアスのための本を探す,Encontre o livro para Elias,找到埃利亚斯的书
STR_O400_Obj,Bring the book to Elias,Bring the book to Elias,Přineste knihu Eliášovi,Bringt das Buch zu Elias,Принесите книгу Элиасу,Zanieś księgę Eliasowi,Vidd el a könyvet Eliasnak,Porta il libro a Elias,Llévale el libro a Elías.,Il n'y a rien à faire ici pour vous... Revenez demain.,把书带给埃利亚斯,エリアスに本を持っていく,Leve o livro para Elias,把书带给埃利亚斯

STR_Q600_Title,The guardian spirit of Radio Zenit,The guardian spirit of Radio Zenit,Strážný duch Rádia Zenit,Der Schutzgeist von Radio Zenit,Дух-хранитель Радио Зенит,Duch opiekuńczy Radia Zenit,A Radio Zenit védőszelleme,Lo spirito custode di Radio Zenit,El espíritu guardián de Radio Zenit,L'esprit gardien de Radio Zenit,泽尼特电台的守护神,ラジオゼニットの守護霊,O espírito guardião da Rádio Zenit,泽尼特电台的守护神
