Language,original,english,czech,german,russian,polish,hungarian,italian,spanish,french,chinese,japanese,portuguese,chinesesimp
syb_perk_desc_15003,"This skill will allow you to steal a random item from the pockets of another person. If you fail, you may be punished, be careful. Successful theft chance","This skill will allow you to steal a random item from the pockets of another person. If you fail, you may be punished, be careful. Successful theft chance","Tato dovednost vám umožní ukrást náhodnou položku z kapes jiné osoby. Pokud selžete, můžete být potrestáni, buďte opatrní. Úspěšná šance na krádež","Mit dieser Fähigkeit können Sie einen zufälligen Gegenstand aus den Taschen einer anderen Person stehlen. Wenn Sie versagen, können Sie bestraft werden, seien Sie vorsichtig. Erfolgreiche Diebstahl -Chance","Данный навык позволит украть случайный предмет из карманов другого человека. В случае неудачи вас могут наказать, будте аккуратны. Шанс успешной кражи","Ta umiejętność pozwoli ci ukraść losowy przedmiot z kieszeni innej osoby. Jeśli się nie uda, możesz zostać ukarany, bądź ostrożny. Udana szansa na kradzież","Ez a készség lehet?vé teszi, hogy egy véletlenszer? elemet ellopjon egy másik személy zsebéb?l. Ha kudarcot vall, büntethet, légy óvatos. Sikeres lopás esélye","Questa abilità ti permetterà di rubare un oggetto casuale dalle tasche di un'altra persona. Se fallisci, potresti essere punito, fai attenzione. Possibilità di furto di successo","Esta habilidad le permitirá robar un elemento aleatorio de los bolsillos de otra persona. Si falla, puede ser castigado, tenga cuidado. Oportunidad de robo exitosa","Cette compétence vous permettra de voler un élément aléatoire des poches d'une autre personne. Si vous échouez, vous pouvez être puni, soyez prudent. Chance de vol réussi",这项技能将使您可以从另一个人的口袋里窃取随机物品。如果您失败了，您可能会受到惩罚，请小心。成功的盗窃机会,このスキルにより、他の人のポケットからランダムなアイテムを盗むことができます。あなたが失敗した場合、あなたは罰せられるかもしれません、注意してください。盗難のチャンスが成功しました,"Essa habilidade permitirá que você roube um item aleatório dos bolsos de outra pessoa. Se você falhar, pode ser punido, tenha cuidado. Chance de roubo bem -sucedido",这项技能将使您可以从另一个人的口袋里窃取随机物品。如果您失败了，您可能会受到惩罚，请小心。成功的盗窃机会
syb_perk_desc_15004,This skill allows you to untie your tied hands behind your back with a chance,This skill allows you to untie your tied hands behind your back with a chance,Tato dovednost vám umožní rozvádět svázané ruce za záda,"Diese Fähigkeit ermöglicht es Ihnen, Ihre gebundenen Hände hinter Ihrem Rücken mit einer Chance zu entfernen",Данный навык позволяет вам развязывать связаные руки за спинок с шансом,Ta umiejętność pozwala na rozwiązywanie wiązanych rąk za plecami,"Ez a készség lehet?vé teszi, hogy egy esélyt kapjon a kötött kezével a hátad mögé",Questa abilità ti permette di slegare le mani legate dietro la schiena con una possibilità,Esta habilidad te permite desatar tus manos atadas a tu espalda con la oportunidad,Cette compétence vous permet de détacher vos mains attachées derrière votre dos avec une chance,这种技能使您有机会将双手绑在背后,このスキルにより、チャンスを持って背中の後ろに縛られた手を切ることができます,Essa habilidade permite que você desamarre suas mãos amarradas atrás das costas com uma chance,这种技能使您有机会将双手绑在背后
syb_perk_desc_15005,This skill allows you to break closed handcuffs with a chance,This skill allows you to break closed handcuffs with a chance,Tato dovednost vám umožní rozbít uzavřené pouta s šancí,Mit dieser Fähigkeit können Sie geschlossene Handschellen mit einer Chance brechen,Данный навык позволяет вам взламывать закрытые наручники с шансом,Ta umiejętność pozwala na złamanie zamkniętych kajdanek z szansą,"Ez a készség lehet?vé teszi, hogy esélyt eltörjön a zárt bilincsekkel",Questa abilità ti consente di rompere le manette chiuse con una possibilità,Esta habilidad te permite romper las esposas cerradas con la oportunidad,Cette compétence vous permet de casser les menottes fermées avec une chance,这种技能使您可以打开闭合的手铐，并有机会,このスキルにより、チャンスで閉じた手錠を壊すことができます,Essa habilidade permite que você quebre algemas fechadas com uma chance,这种技能使您可以打开闭合的手铐，并有机会
syb_perk_desc_15006,You can pretend to have your hands tied behind your back to trick another survivor,You can pretend to have your hands tied behind your back to trick another survivor,"Můžete předstírat, že máte svázané ruce za zády, abyste oklamali jiného přeživšího","Sie können so tun, als hätten Sie Ihre Hände hinter Ihrem Rücken gebunden, um einen anderen Überlebenden auszutricksen","Вы можете прикинуться, что у вас связаны руки за спиной, чтобы обмануть другого выжившего","Możesz udawać, że masz ręce przywiązane za plecami, aby oszukać innego ocalałego","Úgy teheted, mintha a kezed a hátad mögött van kötve, hogy becsapjon egy másik túlél?t",Puoi fingere di avere le mani legate alle spalle per ingannare un altro sopravvissuto,Puedes fingir tener tus manos atadas a la espalda para engañar a otro sobreviviente,Vous pouvez faire semblant d'avoir vos mains attachées derrière votre dos pour tromper un autre survivant,您可以假装将双手绑在背后欺骗另一个幸存者,あなたはあなたの手をあなたの背中の後ろに縛って別の生存者をだましているふりをすることができます,Você pode fingir que as mãos estão presas atrás das costas para enganar outro sobrevivente,您可以假装将双手绑在背后欺骗另一个幸存者
syb_perk_desc_15007,Lock picking tools will last longer if handled with care on,Lock picking tools will last longer if handled with care on,"Nástroje pro výběr zámku vydrží déle, pokud se zachází s opatrností","Die Sperren -Picking -Tools dauern länger, wenn sie mit Vorsorge behandelt werden",Инструменты для взлома замков будут служить вам дольше при бережном обращении с ними на,"Narzędzia do zbierania blokady będą trwać dłużej, jeśli są obsługiwane z ostrożnością","A reteszel? szerszámok hosszabb ideig tartanak, ha gondosan kezelik",Blocca gli strumenti di raccolta dureranno più a lungo se gestiti con cura,Las herramientas de selección de bloqueo durarán más si se maneja con cuidado,Les outils de cueillette de verrouillage dureront plus longtemps s'ils sont manipulés avec soin,如果谨慎处理，锁定工具将持续更长的时间,ロックピッキングツールは、注意して処理すると長持ちします,As ferramentas de picking de bloqueio durarão mais se tratadas com cuidado,如果谨慎处理，锁定工具将持续更长的时间
syb_perk_desc_16000,You can collect herbs in the fields for making tinctures and medicines,You can collect herbs in the fields for making tinctures and medicines,Byliny můžete sbírat v polích pro výrobu tinktur a léků,"Sie können Kräuter auf den Feldern sammeln, um Tinkturen und Medikamente herzustellen",Вы можете собирать травы в полях для приготовления настоек и лекарств,Możesz zbierać zioła na polach do robienia nalewek i leków,Gyógyszereket gy?jthet a mez?kön tinktúrák és gyógyszerek készítéséhez,Puoi raccogliere erbe nei campi per fare tinture e medicine,Puedes recolectar hierbas en los campos para hacer tinturas y medicamentos.,Vous pouvez récupérer des herbes dans les champs pour fabriquer des teintures et des médicaments,您可以在田间收集草药，以制作tin剂和药物,チンキや薬を作るためにフィールドでハーブを集めることができます,Você pode coletar ervas nos campos para fazer tinturas e medicamentos,您可以在田间收集草药，以制作tin剂和药物
syb_perk_desc_16001,You can determine the properties of the harvested herb,You can determine the properties of the harvested herb,Vlastnosti sklizené byliny můžete určit,Sie können die Eigenschaften des geernteten Krauts bestimmen,Вы можете определить свойства собраной травы,Możesz określić właściwości zebranego ziół,Meghatározhatja a betakarított gyógynövény tulajdonságait,Puoi determinare le proprietà dell'erba raccolta,Puede determinar las propiedades de la hierba cosechada,Vous pouvez déterminer les propriétés de l'herbe récoltée,您可以确定收获草药的特性,収穫されたハーブの特性を決定できます,Você pode determinar as propriedades da erva colhida,您可以确定收获草药的特性
syb_perk_desc_16002,Herbalism tools will last longer when handled with care in,Herbalism tools will last longer when handled with care in,"Nástroje bylinství budou trvat déle, když se zachází s péčí","Herbalismuswerkzeuge dauern länger, wenn sie mit Sorgfalt behandelt werden",Инструменты для травничества будут служить вам дольше при бережном обращении с ними на,"Narzędzia ziołowe będą trwać dłużej, gdy są obsługiwane ostrożnie","A gyógynövényes eszközök hosszabb ideig tartanak, ha gondosan kezelik",Gli strumenti di erboristica dureranno più a lungo quando gestiti con cura,Las herramientas de herbalismo durarán más cuando se manejen con cuidado en,Les outils d'herborisme dureront plus longtemps lorsqu'ils sont manipulés avec soin,当谨慎处理时，草药工具将持续更长的时间,ハーブリズムツールは、で注意を払って処理すると長持ちします,As ferramentas de herbalismo durarão mais tempo quando tratadas com cuidado em,当谨慎处理时，草药工具将持续更长的时间
syb_perk_desc_16003,You have learned how to create stronger tinctures and preparations for,You have learned how to create stronger tinctures and preparations for,"Naučili jste se, jak vytvářet silnější tinktury a přípravy na","Sie haben gelernt, wie man stärkere Tinkturen und Vorbereitungen erstellt",Вы научились создавать более сильные настойки и препараты на,Nauczyłeś się tworzyć silniejsze nalewki i przygotowania,"Megtanultad, hogyan lehet er?sebb tinktúrákat és el?készítéseket létrehozni",Hai imparato a creare tinture e preparativi più forti,Has aprendido a crear tinturas y preparativos más fuertes para,Vous avez appris à créer des teintures et des préparatifs plus forts pour,您已经学会了如何为,あなたはより強力なチンキと準備を作成する方法を学びました,Você aprendeu a criar tinturas e preparativos mais fortes para,您已经学会了如何为
syb_perk_desc_16004,The number of tinctures and preparations produced increases by,The number of tinctures and preparations produced increases by,Počet produkovaných přípravků a přípravků se zvyšuje,Die Anzahl der erzeugten Tinkturen und Präparate nimmt zu,Количество произведенных настоек и препаратов увеличивается на,Liczba nalewek i preparatów wzrasta przez,A termelt tinktúrák és készítmények száma növekszik,Il numero di tinture e preparazioni prodotte aumentano di,El número de tinturas y preparaciones producidos aumentos por,Le nombre de teintures et de préparations produites augmente par,tin剂和制剂的数量增加了,チンキと準備の数は増加します,O número de tinturas e preparativos produzidos aumenta por,tin剂和制剂的数量增加了
syb_perk_desc_17000,You can process animal skins to create leather and fur items,You can process animal skins to create leather and fur items,Můžete zpracovat zvířecí kůže a vytvářet kožené a kožešinové předměty,"Sie können Tierhäute verarbeiten, um Leder- und Pelzartikel zu kreieren",Вы можете обрабатывать шкуры животных для создания кожаных и меховых вещей,Możesz przetwarzać skórki zwierząt w celu tworzenia skóry i futra,Az állati b?röket feldolgozhatja b?r- és sz?rmecikkek készítéséhez,Puoi elaborare le pelli di animali per creare oggetti in pelle e pelliccia,Puedes procesar pieles de animales para crear artículos de cuero y piel.,Vous pouvez traiter les peaux d'animaux pour créer des articles en cuir et en fourrure,您可以处理动物皮肤以创建皮革和皮草物品,動物の皮を処理して革と毛皮のアイテムを作成できます,Você pode processar peles de animais para criar itens de couro e peles,您可以处理动物皮肤以创建皮革和皮草物品
syb_perk_desc_17001,You can repair damaged hides more efficiently before,You can repair damaged hides more efficiently before,Předtím můžete efektivněji opravit poškozené úkryty,Sie können beschädigte Häute vorher effizienter reparieren,Вы можете ремонтировать испорченные шкуры более эффективно до,Możesz wcześniej naprawić uszkodzone ukrywanie się wcześniej,Korábban hatékonyabban javíthatja a sérült rejt?zködést,È possibile riparare le pelli danneggiate in modo più efficiente prima,Puede reparar las pieles dañadas de manera más eficiente antes,Vous pouvez réparer plus efficacement les peaux endommagées avant,您可以更有效地修复损坏的皮套,損傷した皮をより効率的に修理することができます,Você pode reparar couros danificados com mais eficiência antes,您可以更有效地修复损坏的皮套
syb_perk_desc_17002,You can process sheep wool to create warm woolen garments,You can process sheep wool to create warm woolen garments,Můžete zpracovat ovčí vlnu a vytvářet teplé vlněné oděvy,"Sie können Schafwolle verarbeiten, um warme Wollkleidungsstücke zu kreieren",Вы можете обрабатывать шерсть овец для создания теплых шерстяных вещей,"Możesz przetworzyć wełnę owczą, aby tworzyć ciepłe wełniane ubrania",A juhgyapot feldolgozhatja meleg gyapjú ruhadarabok létrehozásához,Puoi elaborare lana di pecora per creare indumenti di lana caldi,Puedes procesar lana de oveja para crear prendas de lana calientes,Vous pouvez traiter la laine de mouton pour créer des vêtements de laine chauds,您可以处理绵羊羊毛以制作温暖的羊毛服装,あなたは羊のウールを加工して暖かい羊毛の衣服を作ることができます,Você pode processar lã ovelha para criar roupas de lã quentes,您可以处理绵羊羊毛以制作温暖的羊毛服装
syb_perk_desc_17003,You can process cotton to create lightweight and durable garments,You can process cotton to create lightweight and durable garments,Můžete zpracovat bavlnu a vytvářet lehké a odolné oděvy,"Sie können Baumwolle verarbeiten, um leichte und langlebige Kleidungsstücke zu erstellen",Вы можете обрабатывать хлопок для создания легких и прочных вещей,"Możesz przetworzyć bawełnę, aby stworzyć lekkie i trwałe ubrania","Feldolgozhatja a pamutot, hogy könny? és tartós ruhákat hozzon létre",È possibile elaborare il cotone per creare indumenti leggeri e durevoli,Puede procesar algodón para crear prendas livianas y duraderas.,Vous pouvez traiter du coton pour créer des vêtements légers et durables,您可以加工棉花以制作轻巧耐用的服装,綿を処理して、軽量で耐久性のある衣服を作成できます,Você pode processar algodão para criar roupas leves e duráveis,您可以加工棉花以制作轻巧耐用的服装
syb_perk_desc_17004,"When cutting old things, you get more material on","When cutting old things, you get more material on",Při řezání starých věcí získáte více materiálu,"Wenn Sie alte Dinge schneiden, erhalten Sie mehr Material an",При разрезании старых вещей вы получаете больше материала на,Podczas cięcia starych rzeczy masz więcej materiału,A régi dolgok vágásakor több anyagot kapsz,"Quando si taglia le cose vecchie, ottieni più materiale","Al cortar cosas viejas, obtienes más material sobre","Lorsque vous coupez de vieilles choses, vous obtenez plus de matériel sur",切割旧的东西时，您会得到更多的材料,古いものを切るとき、あなたはより多くの資料を得る,"Ao cortar coisas antigas, você obtém mais material em",切割旧的东西时，您会得到更多的材料
syb_perk_desc_17005,You can repair things more efficiently at,You can repair things more efficiently at,Můžete věci opravit efektivněji na,Sie können die Dinge effizienter reparieren,Вы можете более эффективно ремонтировать вещи на,Możesz skuteczniej naprawić rzeczy,A dolgokat hatékonyabban javíthatja,Puoi riparare le cose in modo più efficiente,Puede reparar las cosas de manera más eficiente en,Vous pouvez réparer les choses plus efficacement à,您可以在,より効率的に修理できます,Você pode reparar as coisas com mais eficiência em,您可以在
syb_perk_desc_17006,Tailor tools will last longer when handled with care on,Tailor tools will last longer when handled with care on,"Nástroje na míru budou trvat déle, když se zachází s péčí","Schneiderwerkzeuge dauern länger, wenn sie mit Sorgfalt behandelt werden",Инструменты портного будут служить вам дольше при бережном обращении с ними на,"Narzędzia krawieckie będą trwać dłużej, gdy są obsługiwane z ostrożnością","A szabószerszámok hosszabb ideig tartanak, ha gondosan kezelik",Gli strumenti su misura dureranno più a lungo quando gestiti con cura,Las herramientas de sastre durarán más cuando se manejen con cuidado,Les outils de tailleur dureront plus longtemps lorsqu'ils sont manipulés avec soin,量身定制工具会持续更长的时间。,テーラーツールは、注意を払って処理すると長持ちします,As ferramentas de alfaiate durarão mais quando tratadas com cuidado,量身定制工具会持续更长的时间。
syb_perk_desc_2,"Your body is better able to resist the zombie virus, as a result of which infection and degradation of the body is slower by","Your body is better able to resist the zombie virus, as a result of which infection and degradation of the body is slower by","Vaše tělo dokáže lépe odolat viru zombie, v důsledku toho, která infekce a degradace těla je pomalejší",Ihr Körper kann dem Zombie -Virus besser widerstehen,"Ваш организм лучше сопротивляется зомби вирусу, в следствии чего заражение и деградация организма происходит медленнее на","Twoje ciało jest w stanie lepiej oprzeć się wirusowi zombie, w wyniku czego infekcja i degradacja ciała jest wolniejsza","A tested jobban képes ellenállni a zombi vírusnak, amelynek eredményeként a test fert?zése és lebomlása lassabb","Il tuo corpo è in grado di resistere meglio al virus zombi, a causa della quale l'infezione e la degradazione del corpo sono più lente","Su cuerpo está mejor capaz de resistir el virus zombie, como resultado de la cual la infección y la degradación del cuerpo son más lentas por","Votre corps est mieux en mesure de résister au virus des zombies, à la suite de quelle infection et de la dégradation du corps est plus lente par",您的身体能够更好地抵抗僵尸病毒，因此身体的感染和降解较慢,あなたの体は、ゾンビウイルスに抵抗することができます。その結果、感染と体の分解が遅くなります,"Seu corpo é mais capaz de resistir ao vírus zumbi, como resultado de qual infecção e degradação do corpo é mais lenta por",您的身体能够更好地抵抗僵尸病毒，因此身体的感染和降解较慢
syb_perk_desc_2000,Your robust physique allows you to carry heavier loads without taking damage for stamina on,Your robust physique allows you to carry heavier loads without taking damage for stamina on,"Vaše robustní postava vám umožňuje nést těžší zatížení, aniž byste poškodili výdrž",Ihr robuster Körper,Ваше крепкое телосложение позволяет переносить более тяжелые грузы на себе без урона для выносливости на,Twoja solidna budowa ciała pozwala nosić cięższe obciążenia bez obrażeń wytrzymałości,"A robusztus fizikája lehet?vé teszi, hogy nehezebb terheléseket hordozjon anélkül, hogy az állóképességet megsértené",Il tuo fisico robusto ti consente di trasportare carichi più pesanti senza subire danni per la resistenza,Su físico robusto le permite llevar cargas más pesadas sin dañar la resistencia,Votre physique robuste vous permet de transporter des charges plus lourdes sans endommager l'endurance,您坚固的体格使您可以承受较重的负载，而不会损害耐力,あなたの堅牢な体格により、スタミナにダメージを与えずに重い荷物を運ぶことができます,Seu físico robusto permite que você carregue cargas mais pesadas sem causar danos à resistência,您坚固的体格使您可以承受较重的负载，而不会损害耐力
syb_perk_desc_2001,Strength movements consume less stamina by,Strength movements consume less stamina by,Pohyby síly konzumují méně vytrvalosti,Kraftbewegungen konsumieren weniger Ausdauer durch,Силовые приемы и движения потребляют меньше выносливости на,Ruchy siłowe zużywają mniej wytrzymałości przez,Az er?mozgások kevesebb kitartást fogyasztanak,I movimenti di forza consumano meno resistenza di,Los movimientos de fuerza consumen menos resistencia por,Les mouvements de force consomment moins d'endurance par,力量运动消耗少的耐力,強度の動きは、より少ないスタミナを消費します,Movimentos de força consomem menos resistência por,力量运动消耗少的耐力
syb_perk_desc_2002,You can jump and climb. Stamina will be spent less on,You can jump and climb. Stamina will be spent less on,Můžete skočit a stoupat. Výdrž bude utracena méně na,Sie können springen und klettern. Ausdauer wird weniger dafür ausgegeben,Вы можете прыгать и взбираться на препятствия более легко. Выносливость будет тратиться меньше на,Możesz skakać i wspinać się. Wytrzymanie zostanie wydane mniej,Ugrás és mászhat. Az állóképességet kevesebbet fogják költeni,Puoi saltare e arrampicarti. La resistenza sarà spesa meno su,Puedes saltar y subir. La resistencia se gastará menos en,Vous pouvez sauter et grimper. L'endurance sera moins dépensée,您可以跳跃并攀登。耐力将减少,ジャンプして登ることができます。スタミナはそれほど費やされません,Você pode pular e escalar. Resistência será gasta menos em,您可以跳跃并攀登。耐力将减少
syb_perk_desc_2003,You can block strikes more easily. Stamina will be spent less on,You can block strikes more easily. Stamina will be spent less on,Úpady můžete snadněji blokovat. Výdrž bude utracena méně na,Sie können Streiks leichter blockieren. Ausdauer wird weniger dafür ausgegeben,Вы можете более легко блокировать удары. Выносливость будет тратиться меньше на,Możesz łatwiej blokować strajki. Wytrzymanie zostanie wydane mniej,Könnyebben blokkolhatja a sztrájkokat. Az állóképességet kevesebbet fogják költeni,Puoi bloccare gli scioperi più facilmente. La resistenza sarà spesa meno su,Puedes bloquear las huelgas más fácilmente. La resistencia se gastará menos en,Vous pouvez bloquer les frappes plus facilement. L'endurance sera moins dépensée,您可以更轻松地阻止罢工。耐力将减少,ストライクをより簡単にブロックできます。スタミナはそれほど費やされません,Você pode bloquear as greves com mais facilidade. Resistência será gasta menos em,您可以更轻松地阻止罢工。耐力将减少
